{
  "command_id": "cmd-01",
  "kind": "ResultAccepted",
  "payload_ref": {
    "bytes": 769,
    "media_type": "application/json",
    "sha256": "5e0034d35cf3e900510396c8139045c9b26cbd69637c060bc1899a200f2c9ea2"
  },
  "previous_hash": "0000000000000000000000000000000000000000000000000000000000000000",
  "run_id": "run-01",
  "run_revision": 8,
  "schema": "gabriel.event/1",
  "sequence": 41,
  "task_id": "task-01"
}
